{"resultsPerPage":1,"startIndex":0,"totalResults":1,"format":"NVD_CVEHistory","version":"2.0","timestamp":"2023-02-24T22:39:32.583","cveChanges":[{"change":{"cveId":"CVE-2022-3115","eventName":"Initial Analysis","cveChangeId":"1A6CC8F6-5DB2-40AA-99C7-71710FE37293","sourceIdentifier":"nvd@nist.gov","created":"2022-12-16T21:24:16.357","details":[{"action":"Added","type":"CVSS V3.1","newValue":"NIST AV:L\/AC:L\/PR:L\/UI:N\/S:U\/C:N\/I:N\/A:H"},{"action":"Changed","type":"Reference Type","oldValue":"https:\/\/bugzilla.redhat.com\/show_bug.cgi?id=2153058 No Types Assigned","newValue":"https:\/\/bugzilla.redhat.com\/show_bug.cgi?id=2153058 Issue Tracking, Third Party Advisory"},{"action":"Changed","type":"Reference Type","oldValue":"https:\/\/git.kernel.org\/pub\/scm\/linux\/kernel\/git\/torvalds\/linux.git\/commit\/?h=v5.19-rc2&id=73c3ed7495c67b8fbdc31cf58e6ca8757df31a33 No Types Assigned","newValue":"https:\/\/git.kernel.org\/pub\/scm\/linux\/kernel\/git\/torvalds\/linux.git\/commit\/?h=v5.19-rc2&id=73c3ed7495c67b8fbdc31cf58e6ca8757df31a33 Patch, Vendor Advisory"},{"action":"Added","type":"CPE Configuration","newValue":"OR\n     *cpe:2.3:o:linux:linux_kernel:*:*:*:*:*:*:*:* versions up to (excluding) 5.16.0\n     *cpe:2.3:o:linux:linux_kernel:5.16.0:-:*:*:*:*:*:*\n     *cpe:2.3:o:linux:linux_kernel:5.16.0:rc1:*:*:*:*:*:*\n     *cpe:2.3:o:linux:linux_kernel:5.16.0:rc2:*:*:*:*:*:*\n     *cpe:2.3:o:linux:linux_kernel:5.16.0:rc3:*:*:*:*:*:*\n     *cpe:2.3:o:linux:linux_kernel:5.16.0:rc4:*:*:*:*:*:*\n     *cpe:2.3:o:linux:linux_kernel:5.16.0:rc5:*:*:*:*:*:*\n     *cpe:2.3:o:linux:linux_kernel:5.16.0:rc6:*:*:*:*:*:*"}]}}]}